STT,nameProject_VNI,nameProject_ENG,difficulty_level,codeSememter,major,specialization,university,note
1,Xây dựng hệ thống quản lý sân cầu lông,,1,232,,,UIT,
2,Tìm hiểu công nghệ Web 3.0 và ứng dụng web 3.0 vào thực tiễn,,1,232,,,UIT,
3,Xây dựng hệ thống trợ giúp tư vấn hướng nghiệp và chọn ngành cho học sinh THPT,,1,232,,,UIT,
4,Xây dựng mạng xã hội kết hợp chatbot cho người nuôi thú cưng,,1,232,,,UIT,
5,Tìm hiểu Chatbot và xây dựng ứng dụng hỗ trợ tư vấn thuê bất động sản,,1,232,,,UIT,
6,Tìm hiểu Chatbot và xây dựng ứng dụng hỗ trợ tư vấn mua bán bất động sản,,1,232,,,UIT,
7,Nghiên cứu và thử nghiệm một số phương pháp định giá BĐS,,1,232,,,UIT,
8,Phân tích xu hướng bất động sản bằng Machine Learning kết hợp lịch sử giá và tin tức,,1,232,,,UIT,
9,Xây dựng hệ thống quản lý phòng trọ và gợi ý cho thuê phòng trọ.,,1,232,,,UIT,
10,Xây dựng Ứng dụng đi chợ trực tuyến tích hợp gợi ý món ăn,,1,232,,,UIT,
11,Xây dựng Shop quần áo online tích hợp gợi ý sản phẩm,,1,232,,,UIT,
12,Xây dựng Ứng dụng nghe nhạc và gợi ý bài hát,,1,232,,,UIT,
13,Tìm hiểu và phát triển ứng dụng giúp việc và cho thuê với Flutter,,1,232,,,UIT,
14,Nghiên cứu công nghệ livestream và xây dựng ứng dụng minh hoạ,,1,232,,,UIT,
15,Nghiên cứu công nghệ blockchain và ứng dụng vào game,,1,232,,,UIT,
16,Nghiên cứu hệ khuyến nghị trong hệ thống thương mại điện tử,,1,232,,,UIT,
17,Nghiên cứu hệ thống phân tán và ứng dụng minh hoạ,,1,232,,,UIT,
18,Nghiên cứu các kĩ thuật đồng thuận trong blockchain,,1,232,,,UIT,
19,Nghiên cứu blockchain bridge và ứng dụng,,1,232,,,UIT,
20,Xây dựng ứng dụng Web DeFi trên Blockchain,,1,232,,,UIT,
21,Xây dựng ứng dụng hỗ trợ học tiếng anh trên thiết bị di động có áp dụng mô hình trí tuệ nhân tạo.,,1,232,,,UIT,
22,phát triển ứng dụng hỗ trợ học tiếng Anh kết hợp AI,,1,232,,,UIT,
23,Sign Language Detection,,1,232,,,UIT,
24,Phát triển ứng dụng mua đồ ăn trực tuyến kết hợp tính năng đăng bài và gợi ý người dùng,,1,232,,,UIT,
25,Phát triển game3D tương tác và thực thể ảo AR với Unity trên môi trường Android,,1,232,,,UIT,
26,Phát triển ứng dụng phân tích dữ liệu y khoa trong xét nghiệm máu,,1,232,,,UIT,
27,"Tìm hiểu Thị giác máy tính vận dụng trong phát triển ứng dụng Game 3D tương tác, Thực thể ảo AR.",,1,232,,,UIT,
28,Dự báo qua hành vi mua sắm của người tiêu dùng trong hoạt động kinh doanh hàng tiêu dùng,,1,232,,,UIT,
29,Xây dựng hệ thống tư vấn chọn ngành Đại học cho học sinh Trung học Phổ Thông,,1,232,,,UIT,
30,Phát triển ứng dụng hỗ trợ trẻ em tự kỷ,,1,232,,,UIT,
31,Thiết kế Micro Front End với React Native,,1,232,,,UIT,
32,Thiết kế hệ thống với K8s,,1,232,,,UIT,
33,"Tìm hiểu về Flutter, clean architecture và xây dựng Ứng dụng chia sẻ công thức nấu ăn",,1,232,,,UIT,
34,Thiết kế hệ thống với Spring Boot,,1,232,,,UIT,
35,Phân tích hệ thống khuyến mãi (promotion) cho bán hàng đa kênh (Omnichannel),,1,232,,,UIT,
36,Phân tích hệ thống e-catalog sản phẩm cho bán hàng đa kênh (Omnichannel),,1,232,,,UIT,
37,Phân tích hệ thống e-shopping cart cho bán hàng đa kênh (Omnichannel),,1,232,,,UIT,
38,Công cụ AI tốt nhất dành cho việc lập trình,,1,232,,,UIT,
39,Dự đoán trên dữ liệu chuỗi thời gian với Transformer (Time Series Prediction with Transformers),,1,232,,,UIT,
40,Xây dựng Chrome extension hữu ích cho sinh viên UIT,,1,232,,,UIT,
41,Xây dựng ứng dụng Sổ tay tài chính,,1,232,,,UIT,
42,Xây dựng ứng dụng Sổ tay mua sắm trực tuyến,,1,232,,,UIT,
43,Tìm hiểu cách tối ưu hoá truy vấn trên Big Data,,1,232,,,UIT,
44,Xây dựng ứng dụng tin tức sinh viên mềm,,1,232,,,UIT,
45,Xây dựng ứng dụng mua sắm đa sàn tích hợp,,1,232,,,UIT,
46,Xây dựng chức năng gợi ý bài hát cho web nghe nhạc trực tuyến,,1,232,,,UIT,
47,Phát triển ứng dụng hỗ trợ lập kế hoạch lịch trình sự kiện,,1,232,,,UIT,
48,Xây dựng ứng dụng bản đồ tai nạn giao thông ở Việt Nam,,1,232,,,UIT,
49,Xây dựng ứng dụng nhật ký âm nhạc,,1,232,,,UIT,
50,Tìm hiểu kỹ thuật lập trình mạng và tối ưu đường truyền,,1,232,,,UIT,
51,Xây dựng website nghe nhạc kết hợp gợi ý và tìm kiếm giai điệu,,1,232,,,UIT,
52,Tìm hiểu và xây dựng hệ thống truy vấn dựa trên ngữ nghĩa: Ứng dụng trong lĩnh vực pháp luật,,1,232,,,UIT,
53,Xây dựng website nghe nhạc trực tuyến tích hợp hệ thống khuyến nghị,,1,232,,,UIT,
54,Xây dựng ứng dụng quản lý chi tiêu,,1,232,,,UIT,
55,Xây dựng ứng dụng hẹn hò và kết bạn,,1,232,,,UIT,
56,Xây dựng website quản lý cửa hàng café,,1,232,,,UIT,
57,Xây dựng website thương mại điện tử bán giày dép,,1,232,,,UIT,
58,Xây dựng website thương mại điện tử cho hệ thống nhà sách,,1,232,,,UIT,
59,Xây dựng website quản lý trang trại heo,,1,232,,,UIT,
60,Xây dựng website quản lý nhân sự cho doanh nghiệp IT quy mô nhỏ,,1,232,,,UIT,
61,Xây dựng hệ thống kỹ năng cho game nhập vai 2D,,1,232,,,UIT,
62,Xây dựng website đặt phòng khách sạn bằng kiến trúc Microservice kết hợp sử dụng gRPC,,1,232,,,UIT,
63,Xây dựng ứng dụng quản lý quán café trên nền tảng windows và mobile,,1,232,,,UIT,
64,Xây dựng ứng dụng quản lý tài chính trên thiết bị di động,,1,232,,,UIT,
65,Xây dựng ứng dụng mua bán cây cảnh,,1,232,,,UIT,
66,Xây dựng website mạng xã hội truyện tranh,,1,232,,,UIT,
67,Xây dựng ứng dụng chia sẻ phương pháp học tập,,1,232,,,UIT,
68,Xây dựng ứng dụng tìm bạn ở ghép phòng trọ,,1,232,,,UIT,
69,Xây dựng ứng dụng chia sẻ thực phẩm,,1,232,,,UIT,
70,Xây dựng ứng dụng quản lý quy trình thực hiện đề tài NCKH sinh viên,,1,232,,,UIT,
71,Xây dựng ứng dụng quản lý lịch sử các hoạt động của gia đình,,1,232,,,UIT,
72,Sử dụng Google ML Kit để xây dựng ứng dụng đọc hóa đơn tự động với Flutter,,1,232,,,UIT,
73,Sử dụng Google ML Kit để xây dựng ứng dụng học các tư thế Yoga với Flutter,,1,232,,,UIT,
74,Sử dụng Google ML Kit để xây dựng mini game với Flutter,,1,232,,,UIT,
75,Xây dựng ứng dụng phát nhạc theo cảm xúc khuôn mặt với React Native,,1,232,,,UIT,
76,Xây dựng ứng dụng điểm danh tự động bằng khuôn mặt với React Native,,1,232,,,UIT,
77,Xây dựng website thương mại điện tử dựa trên mô hình microservice và cơ sở dữ liệu phân tán,,1,232,,,UIT,
78,Xây dựng website quản lý nhân sự,,1,232,,,UIT,
79,Phát triển sàn thương mại mua bán sản phẩm điện tử,,1,232,,,UIT,
80,Xây dựng trang nghe nhạc trực tuyến với mô hình gói đăng ký,,1,232,,,UIT,
81,Game 2D multiplayer nền tảng di động,,1,232,,,UIT,
82,Ứng dụng quản lý mua sắm đồ điện tử online có thanh toán qua Momo,,1,232,,,UIT,
83,"Tìm hiểu Flutter, BloC và xây dựng ứng dụng quản lý công việc",,1,232,,,UIT,
84,"Ứng dụng nhắn tin kết bạn, bảo vệ người dùng khỏi tin nhắn quấy rối",,1,232,,,UIT,
85,Nghiên cứu và xây dựng ứng dụng phân loại rác và gây quỹ cộng đồng,,1,232,,,UIT,
86,Xây dựng website cộng đồng cho phép đăng tải và trao đổi các bài viết,,1,232,,,UIT,
87,Nghiên cứu các phương pháp tự động sinh câu mô tả cho ảnh và xây dựng ứng dụng,,1,232,,,UIT,
88,Thiết kế game 2D Platformer theo thể loại RPG,,1,232,,,UIT,
89,Xây dựng ứng dụng siêu thị trực tuyến kết hợp gợi ý sản phẩm và dự đoán xu hướng thị trường,,1,232,,,UIT,
90,Phát triển hệ thống hỗ trợ tra cứu vùng canh tác nông nghiệp dựa trên bản đồ Open Street Map (OSM),,1,232,,,UIT,
91,Áp dụng kiến trúc Microservices vào việc phát triển hệ thống thương mại điện tử,,1,232,,,UIT,
92,Xây dựng ứng dụng đặt đồ ăn trực tuyến áp dụng hệ khuyến nghị dựa trên mức độ yêu thích của người dùng,,1,232,,,UIT,
93,Xây dựng ứng dụng hỗ trợ học nhảy,,1,232,,,UIT,
94,Tìm hiểu công nghệ Web 3.0 và ứng dụng web 3.0 vào thực tiễn,,2,232,,,UIT,
95,Xây dựng hệ thống trợ giúp tư vấn hướng nghiệp và chọn ngành cho học sinh THPT,,2,232,,,UIT,
96,Xây dựng mạng xã hội kết hợp chatbot cho người nuôi thú cưng,,2,232,,,UIT,
97,Tìm hiểu Chatbot và xây dựng ứng dụng hỗ trợ tư vấn thuê bất động sản,,2,232,,,UIT,
98,Tìm hiểu Chatbot và xây dựng ứng dụng hỗ trợ tư vấn mua bán bất động sản,,2,232,,,UIT,
99,Nghiên cứu và thử nghiệm một số phương pháp định giá BĐS,,2,232,,,UIT,
100,Phân tích xu hướng bất động sản bằng Machine Learning kết hợp lịch sử giá và tin tức,,2,232,,,UIT,
101,Xây dựng hệ thống quản lý phòng trọ và gợi ý cho thuê phòng trọ.,,2,232,,,UIT,
102,Xây dựng Ứng dụng đi chợ trực tuyến tích hợp gợi ý món ăn,,2,232,,,UIT,
103,Xây dựng Shop quần áo online tích hợp gợi ý sản phẩm,,2,232,,,UIT,
104,Xây dựng Ứng dụng nghe nhạc và gợi ý bài hát,,2,232,,,UIT,
105,Tìm hiểu và phát triển ứng dụng giúp việc và cho thuê với Flutter,,2,232,,,UIT,
106,Nghiên cứu công nghệ livestream và xây dựng ứng dụng minh hoạ,,2,232,,,UIT,
107,Nghiên cứu công nghệ blockchain và ứng dụng vào game,,2,232,,,UIT,
108,Nghiên cứu hệ khuyến nghị trong hệ thống thương mại điện tử,,2,232,,,UIT,
109,Nghiên cứu hệ thống phân tán và ứng dụng minh hoạ,,2,232,,,UIT,
110,Nghiên cứu các kĩ thuật đồng thuận trong blockchain,,2,232,,,UIT,
111,Nghiên cứu blockchain bridge và ứng dụng,,2,232,,,UIT,
112,"Xây dựng ứng dụng mua sắm quần áo tích hợp AI (Chatbot, Image search, Virtual fit)",,2,232,,,UIT,
113,"Xây dựng ứng dụng di động hỗ trợ dinh dưỡng - tích hợp công nghệ AI để nhận diện món ăn""",,2,232,,,UIT,
114,"Xây dựng website bán sách dựa trên kiến trúc Microservice""",,2,232,,,UIT,
115,Phát triển ứng dụng Fastfood Kết hợp tính năng gợi ý người dùng,,2,232,,,UIT,
116,Phát triển game3D tương tác và thực thể ảo AR với Unity trên môi trường Android,,2,232,,,UIT,
117,Phát triển ứng dụng phân tích dữ liệu y khoa trong xét nghiệm máu,,2,232,,,UIT,
118,"Tìm hiểu Thị giác máy tính vận dụng trong phát triển ứng dụng Game 3D tương tác, Thực thể ảo AR.",,2,232,,,UIT,
119,Dự báo qua hành vi mua sắm của người tiêu dùng trong hoạt động kinh doanh hàng tiêu dùng,,2,232,,,UIT,
120,Xây dựng hệ thống tư vấn chọn ngành Đại học cho học sinh Trung học Phổ Thông,,2,232,,,UIT,
121,Phát triển ứng dụng hỗ trợ trẻ em tự kỷ,,2,232,,,UIT,
122,Xây dựng Micro Front End với React Native cho Supper App Bác sĩ đồ gia đình,,2,232,,,UIT,
123,Xây dựng hệ thống với K8s,,2,232,,,UIT,
124,Xây dựng hệ thống với Net Core,,2,232,,,UIT,
125,Xây dựng hệ thống với Spring Boot,,2,232,,,UIT,
126,Xây dựng hệ thống khuyến mãi (promotion) cho bán hàng đa kênh (Omnichannel),,2,232,,,UIT,
127,Xây dựng hệ thống e-catalog sản phẩm cho bán hàng đa kênh (Omnichannel),,2,232,,,UIT,
128,Xây dựng hệ thống e-shopping cart cho bán hàng đa kênh (Omnichannel),,2,232,,,UIT,
129,Tìm hiểu về Visual Studio GitHub Copilot Extension Introduces New Features and Enhancements,,2,232,,,UIT,
130,Dự đoán trên dữ liệu chuỗi thời gian Tồn kho (Inventory) với Transformer (Time Series Prediction with Transformers),,2,232,,,UIT,
131,Thiết kế gương chiếu hậu thông minh cho xe máy,,2,232,,,UIT,
132,"Tìm hiểu về thiết kế game và xây dựng game RPG hành động, phiêu lưu, giả tưởng 2D",,2,232,,,UIT,
133,Xây dựng ứng dụng bản đồ tai nạn giao thông,,2,232,,,UIT,
134,Tìm hiểu các phương pháp tối ưu trong lập trình ứng dụng di động,,2,232,,,UIT,
135,Tìm hiểu và xây dựng ứng dụng Ecommerce tích hợp khuyến nghị,,2,232,,,UIT,
136,Nghiên cứu phương pháp rút trích thông tin từ văn bản,,2,232,,,UIT,
137,Xây dựng hệ thống đảm bảo trung thực trong mua bán và vận chuyển vật liệu xây dựng,,2,232,,,UIT,
138,Nghiên cứu các thuật toán và phát triển ứng dụng cho Game 3D,,2,232,,,UIT,
139,"Tìm hiểu các kỹ thuật dựa trên thị giác máy tính và máy học để xây dựng ứng dụng ""Just Walk Out Shopping""",,2,232,,,UIT,
140,Tìm hiểu các kỹ thuật dựa trên thị giác máy tính và máy học để xây dựng ứng dụng cho xe tự lái (Self-Driving),,2,232,,,UIT,
141,Tìm hiểu các kỹ thuật dựa trên thị giác máy tính và máy học để xây dựng ứng dụng giám sát giao thông tự động,,2,232,,,UIT,
142,Tìm hiểu các kỹ thuật dựa trên thị giác máy tính và máy học để xây dựng ứng dụng chuẩn đoán các bệnh trên lá lúa,,2,232,,,UIT,
143,Tìm hiểu các kỹ thuật dựa trên thị giác máy tính và máy học để xây dựng ứng dụng Smart Classroom Monitoring,,2,232,,,UIT,
144,Xây dựng ứng dụng quản lý đề cương môn học,,2,232,,,UIT,
145,Xây dựng ứng dụng hỗ trợ xây dựng nhóm học tập,,2,232,,,UIT,
146,Xây dựng ứng dụng chia sẻ kinh nghiệm học tập,,2,232,,,UIT,
147,Xây dựng ứng dụng gia sư trong sinh viên,,2,232,,,UIT,
148,Xây dựng game tương tác giáo dục cho mẹ và bé,,2,232,,,UIT,
149,Xây dựng game giúp tăng cường kết nối Cả nhà cùng vui,,2,232,,,UIT,
150,Xây dựng ứng dụng quản lý tổ chức các hoạt động sinh viên,,2,232,,,UIT,
151,Phát triển ứng dụng tư vấn sức khỏe,,2,232,,,UIT,
152,Phát triển ứng dụng luyện TOEIC,,2,232,,,UIT,
153,Phát triển ứng dụng giải trí học tiếng Anh,,2,232,,,UIT,
154,Xây dựng ứng dụng luyện nói tiếng Anh cộng đồng,,2,232,,,UIT,
155,Phát triển website mạng xã hội tích hợp HLS,,2,232,,,UIT,
156,Xây dựng website cho hotel/resort,,2,232,,,UIT,
157,Xây dựng ứng dụng di động kinh doanh đồ nội thất,,2,232,,,UIT,
158,Xây dựng hệ thống quản lý sự kiện và bán vé,,2,232,,,UIT,
159,Phát triển hệ thống mua sắm trực tuyến,,2,232,,,UIT,
160,Xây dựng website bán giày tích hợp chatbot,,2,232,,,UIT,
161,Xây dựng website và app mobile TMĐT tích hợp hệ thống khuyến nghị,,2,232,,,UIT,
162,Phát triển website đọc truyện tranh,,2,232,,,UIT,
163,Xây dựng website bán đồ công nghệ,,2,232,,,UIT,
164,Phát triển ứng dụng nghe nhạc và chia sẻ bài hát với Flutter,,2,232,,,UIT,
165,Phát triển ứng dụng hỗ trợ học tiếng Anh tăng thích nghi và tương tác (mobile),,2,232,,,UIT,
166,Tìm hiểu về Entity Component System của Unity và làm sản phẩm demo,,2,232,,,UIT,
167,Sử dụng AI để khôi phục tạo hình ảnh có độ phân giải cao,,2,232,,,UIT,
168,"Tìm hiểu Reactjs và xây dựng website quản lý đăng ký môn học và học phí
",,2,232,,,UIT,
169,Ứng dụng chatbot vào ứng dụng thương mại điện tử,,2,232,,,UIT,
170,Ứng dụng mạng xã hội chia sẻ video ngắn,,2,232,,,UIT,
171,Xây dựng website đặt lịch khám bệnh online,,2,232,,,UIT,
172,"Tìm hiểu MAUI , Blazor để xây dựng ứng dụng web, di động forum ẩn danh chỉ sinh viên UIT có thể đăng bài, bình luận, ...",,2,232,,,UIT,
173,Website hỗ trợ học và ghi nhớ tiếng anh theo phương pháp FibonacciEnglish,,2,232,,,UIT,
174,"Tìm hiều về E-Learning và xây dựng web app học, chia sẻ kiến thức lập trình",,2,232,,,UIT,
175,Nghiên cứu các phương pháp phân loại ảnh và xây dựng ứng dụng phân loại các bệnh trên lá cây trồng,,2,232,,,UIT,
176,Nghiên cứu các phương pháp phân loại ảnh xây dựng ứng dụng phân loại các loài sâu hại trên cây trồng,,2,232,,,UIT,
177,Nghiên cứu các phương pháp nhận dạng cử chỉ tay (Hand Gesture Recognition) và xây dựng ứng dụng,,2,232,,,UIT,
178,Nghiên cứu phương pháp nhận dạng cảm xúc khuôn mặt và xây dựng chức năng tương ứng cho ứng dụng Smart Classroom Monitoring,,2,232,,,UIT,
179,Nghiên cứu các phương pháp nhận biết ảnh giả mạo và xây dựng ứng dụng,,2,232,,,UIT,
180,Nghiên cứu các phương pháp nhận biết video giả mạo và xây dựng ứng dụng,,2,232,,,UIT,
181,Nghiên cứu các phương pháp phát hiện các vùng giả mạo bằng deepfake trong ảnh và xây dựng ứng dụng,,2,232,,,UIT,
182,Xây dựng mội trường giao thông giả lập lũ lụt chụp từ Drone và ứng dụng phát hiện phương tiện giao thông trong điều kiện này,,2,232,,,UIT,
183,Xây dựng mội trường giao thông giả lập mưa chụp từ Drone và ứng dụng phát hiện phương tiện giao thông trong điều kiện này,,2,232,,,UIT,
184,Xây dựng mội trường giao thông giả lập ban đêm chụp từ Drone và ứng dụng phát hiện phương tiện giao thông trong điều kiện này,,2,232,,,UIT,
185,"Nghiên cứu các phương pháp chuẩn đoán ảnh y khoa trên đa nền tảng (X-ray, MRI, CT, ultrasound) và xây dựng ứng dụng",,2,232,,,UIT,
186,"Nghiên cứu các phương pháp ""Explainable Object Recognition"" trên ảnh y khoa và xây dựng ứng dụng hỗ trợ ra quyết định cho bác sĩ",,2,232,,,UIT,
187,Nghiên cứu các phương pháp học tăng cường (incremental learning) và xây dựng ứng dụng giám sát giao thông tự động,,2,232,,,UIT,
188,Phát triển hệ thống hỗ trợ quản lý tài chính cho giải pháp vay ngang hàng tích hợp với học máy,,2,232,,,UIT,
189,Phát triển hệ thống hỗ trợ tự động hóa quy trình hoạt động doanh nghiệp dựa trên RPA (Robot Process Automation),,2,232,,,UIT,
190,"Phát triển hệ thống hỗ trợ quản trị doanh nghiệp dựa trên Odoo: Áp dụng cho phân hệ quản lý phương tiện, logistics và kho hàng",,2,232,,,UIT,
191,"Tìm hiểu hệ thống khuyến nghị, cơ sở dữ liệu đồ thị và xây dựng ứng dụng minh hoạ",,2,232,,,UIT,
192,Xây dựng website gọi điện và nhắn tin CrossCalling,,2,232,,,UIT,
193,Xây dựng trang web quản lý kinh doanh cho tiệm tạp hóa nhỏ,,,,,,DUT,
194,Xây dựng website đặt phòng khách sạn,,,,,,DUT,
195,Hệ thống quản lý rác tái chế ở hộ gia đình,,,,,,DUT,
196,"Xây dựng ứng dụng hẹn hò, kết bạn và website quản trị",,,,,,DUT,
197,Nền tảng trao đổi các sản phẩm kĩ thuật số sử dụng công nghệ blockchain,,,,,,DUT,
198,Hệ thống quản lý lao động,,,,,,DUT,
199,Mô phỏng địa điểm bằng kỹ thuật Image Stitching,,,,,,DUT,
200,Xây dựng hệ thống hỗ trợ quản lý Đoàn thanh niên trường Đại học Bách Khoa,,,,,,DUT,
201,Xây dựng hệ thống đặt bàn nhà hàng online,,,,,,DUT,
202,Xây dựng ứng dụng hỗ trợ học tiếng anh trên hệ điều hành Android,,,,,,DUT,
203,Xây dựng website chia sẻ hành trình du lịch,,,,,,DUT,
204,Xây dựng App Mobile giới thiệu các bộ phim,,,,,,DUT,
205,Xây dựng website kết nối tình nguyện Việt Nam,,,,,,DUT,
206,Xây dựng trang web trò chuyện trực tuyến,,,,,,DUT,
207,Builing a livechat module for e-commerce website using chatbot technology,,,,,,DUT,
208,Tour Reservation and Booking System,,,,,,DUT,
209,Building a service-oriented Website application to manage and analyze near-infrared spectral data of food,,,,,,DUT,
210,Xây dựng ứng dụng theo dõi thời gian và quản lý công việc của các dự án,,,,,,DUT,
211,Building a website to recommend products for users of the mobile store,,,,,,DUT,
212,Cửa hàng bán sách trực tuyến tích hợp hệ thống gợi ý,,,,,,DUT,
213,Xây dựng hệ thống đánh giá địa điểm du lịch tích hợp chatbot AI,,,,,,DUT,
214,Xây dựng ứng dụng lưu trữ vị trí điểm đến dựa vào tọa độ địa lý,,,,,,DUT,
215,Bảo mật cơ sở hạ tầng mạng với ASA,,,,,,DUT,
216,Xây dựng ứng dụng quản lý tài chính cá nhân,,,,,,DUT,
217,Hệ thống quản lí nhân viên bán thời gian,,,,,,DUT,
218,Ứng dụng từ điển hình vẽ cho trẻ em DoodleDict,,,,,,DUT,
219,Xây dựng website review sách kết hợp hệ thống gợi ý,,,,,,DUT,
220,Website môi giới tuyển dụng ngành Công nghệ thông tin,,,,,,DUT,
221,Xây dựng giải pháp nhà thông minh,,,,,,DUT,
222,Website quản lí cửa hàng thức ăn,,,,,,DUT,
223,Hệ thống đặt vé máy bay trực tuyến và hệ thống quản lý hàng không,,,,,,DUT,
224,Xây dựng website hướng dẫn nấu ăn (tích hợp gợi ý món ăn).,,,,,,DUT,
225,Xây dựng website quản lý bán mỹ phẩm,,,,,,DUT,
226,Xây dựng website dạy học tiếng anh online,,,,,,DUT,
227,Xây dựng website thương mại điện tử,,,,,,DUT,
228,Xây dựng website/ứng dụng hỗ trợ hoạt động đoàn thanh niên tại trường đại học,,,,,,DUT,
229,Xây dựng ứng dụng quản lí bán hàng trên nền tảng Hyperledger Blockchain,,,,,,DUT,
230,Xây dựng hệ thống đề xuất sản phẩm dựa trên Auto-Encoder,,,,,,DUT,
231,Xây dựng ứng dụng blockchain quản lí chuỗi cung ứng,,,,,,DUT,
232,Mysic- Digital Music Service Website,,,,,,DUT,
233,Hệ thống hỗ trợ đăng và tìm kiếm việc làm,,,,,,DUT,
234,Xây dựng website thương mại điện tử sử dụng công nghệ Blockchain,,,,,,DUT,
235,Xây dựng nền tảng tạo và mua bán NFT (non-fungible tokens) - ArtNfts,,,,,,DUT,
236,Data acquisition and analysis system for near-infrared spectrum of food,,,,,,DUT,
237,Solving Age-Invariant Face Recognition and Face Age Synthesis simultaneously using Deep Learning,,,,,,DUT,
238,Building an Android application to assist driving using AI,,,,,,DUT,
239,Xây dựng ứng dụng mạng xã hội Lavender,,,,,,DUT,
240,Xây dựng web game vẽ hình đa người dùng có sử dụng học máy,,,,,,DUT,
241,Xây dựng website quản lý rạp chiếu phim,,,,,,DUT,
242,"Xây dựng website quản lý, gợi ý tìm kiếm trường học",,,,,,DUT,
243,Vietnamese text classification using NLP techniques,,,,,,DUT,
244,Hệ thống quản lý công việc cho nhân viên làm việc remote,,,,,,DUT,
245,Website quản lý tiệm thuốc,,,,,,DUT,
246,Hệ thống cung cấp vật tư y tế cho mọi nhà,,,,,,DUT,
247,Xây dựng ứng dụng blockchain bán hàng trên nền tảng Hyperledger Fabric,,,,,,DUT,
248,Xây dựng hệ thống ghi nhận và khen thưởng nhân viên Kudo,,,,,,DUT,
249,Hệ thống hỗ trợ học tập tiếng Anh trực tuyến,,,,,,DUT,
250,Xây dựng ứng dụng để phát hiện và cảnh báo số điện thoại spam trên nền tảng Android,,,,,,DUT,
251,Đánh giá bảo mật hệ thống thông qua kiểm thử xâm nhập,,,,,,DUT,
252,Xây dựng hệ thống khảo sát người dùng ứng dụng công nghệ Blockchain,,,,,,DUT,
253,Hệ thống quản lý đánh giá năng lực của nhân viên,,,,,,DUT,
254,Quảng cáo và Order sử dụng Facebook Graph API,,,,,,DUT,
255,Xây dựng website quản lý bán hàng,,,,,,DUT,
256,Hệ thống quản lý nhân sự trong công ty (Human Resource Management),,,,,,DUT,
257,Thiết kế công cụ quản lý dự án dựa trên quy trình Scrum,,,,,,DUT,
258,Build A Tour Booking Website – HappyVacation,,,,,,DUT,
259,Xây dựng trang web tiện ích thiết kế đồ họa,,,,,,DUT,
260,Build a nutrition tracking application,,,,,,DUT,
261,Building NFT Marketplace,,,,,,DUT,
262,"Hệ thống chấm code, tổ chức các cuộc thi lập trình trực tuyến BKDNOJ",,,,,,DUT,
263,Xây dựng website quản lý truyện thông qua mạng xã hội,,,,,,DUT,
264,Xây dựng website đánh giá công ty CNTT ở Đà Nẵng,,,,,,DUT,
265,Hệ thống hỗ trợ đặt lịch khám (My Healthy),,,,,,DUT,
266,Xây dựng website bán khóa học (Course Website),,,,,,DUT,
267,xây dựng website nhà hàng healthy food kết hợp kinh doanh thực phẩm organic,,,,,,DUT,
268,Hệ thống bầu cử,,,,,,DUT,
269,Xây dựng website bán hàng,,,,,,DUT,
270,Xây dựng website bán giày tích hợp gợi ý sản phẩm,,,,,,DUT,
271,Xây dựng website quản lý cửa hàng giày dép,,,,,,DUT,
272,Xây dựng Website bán sách,,,,,,DUT,
273,Cooking Recipe,,,,,,DUT,
