STT,nameProject_VNI,nameProject_ENG,difficulty_level,codeSememter,major,specialization,university,note
559,Xây dựng hệ phần mềm hỗ trợ theo dõi chăm sóc bệnh nhân từ xa,,3,231,Công nghệ thông tin,,HCMUS,
560,Dự đoán liên kết trong đồ thị tri thức bằng cách cải tiến và kết hợp mô hình PairRE với các mô hình khác,,3,231,Công nghệ thông tin,,HCMUS,
561,Dự đoán đoán liên kết trong đồ thị tri thức bằng mô hình kết hợp phương pháp quan hệ đường đi và quan hệ láng giềng,,3,231,Công nghệ thông tin,,HCMUS,
562,Phát hiện bố cục văn bản dựa trên mô hình Transformer,,3,231,Công nghệ thông tin,,HCMUS,
563,Phương pháp học không giám sát sử dụng luồng chuẩn hóa 2D cho phân đoạn vùng bất thường trong ảnh chụp,,3,231,Công nghệ thông tin,,HCMUS,
564,Tìm hiểu về việc ứng dụng NFT trong hệ thống đào tạo tín chỉ và xây dựng ứng dụng thử nghiệm,,3,231,Công nghệ thông tin,,HCMUS,
565,Dự đoán liên kết trong đồ thị tri thức sử dụng mạng đồ thị chú ý trong không gian số phức,,3,231,Công nghệ thông tin,,HCMUS,
566,Hệ thống hỗ trợ đăng ký dạy học có tính phí,,3,231,Công nghệ thông tin,,HCMUS,
567,Mạng học sâu phân đoạn dụng cụ phẫu thuật trong ảnh nội soi,,3,231,Công nghệ thông tin,,HCMUS,
568,Chuyển đổi sắc thái ảnh trên dữ liệu không ghép cặp sử dụng mạng học sâu,,3,231,Công nghệ thông tin,,HCMUS,
569,Mô hình nhúng đồ thị tri thức MLP-Mixer dùng để nắm bắt hiệu quả các tương tác thực thể-quan hệ trong bài toán dự đoán liên kết.,,3,231,Công nghệ thông tin,,HCMUS,
570,Dò tìm khối u trong phổi dùng ảnh được chuyển đổi từ tập CT scan,,3,231,Công nghệ thông tin,,HCMUS,
571,Triển khai hệ thống giảm sát Pod trong Kubernetes,,3,231,Công nghệ thông tin,,HCMUS,
572,Xác định sản phẩm trùng nhau trong các trang web thương mại điện tử hỗ trợ so sánh giá tự động ,,3,231,Công nghệ thông tin,,HCMUS,
573,Kỹ thuật phân đoạn ảnh y khoa thích nghi với miền dữ liệu không gắn nhãn,,3,231,Công nghệ thông tin,,HCMUS,
574,Nghiên cứu phát triển hệ thống truy xuất nguồn gốc sản phẩm,,3,231,Công nghệ thông tin,,HCMUS,
575,Xây Dựng Hệ Thống Giảng Dạy Trực Tuyến,,3,231,Công nghệ thông tin,,HCMUS,
576,Nghiên cứu và xây dựng ứng dụng Quant Trading,,3,231,Công nghệ thông tin,,HCMUS,
577,Hướng tiếp cận để cải thiện tính mở rộng của Hệ tư vấn dựa trên bộ nhớ,,3,231,Công nghệ thông tin,,HCMUS,
578,Giải pháp tăng cường cho tương tác di động,,3,231,Công nghệ thông tin,,HCMUS,
579,Nghiên cứu và áp dụng các phương pháp điều khiển truy cập,,3,231,Công nghệ thông tin,,HCMUS,
580,Nghiên cứu các thuật toán khai thác đồ thị áp dụng cho bài toán tư vấn khóa học nghề nghiệp,,3,231,Công nghệ thông tin,,HCMUS,
581,Xây dựng hệ thống chatbot tự động tư vấn tuyển sinh,,,,,,,
,Tìm hiểu về Mongodb,,1,221,Hệ thống thông tin quản lý,Hệ thống thông tin quản lý,HUTECH,Hướng nghiên cứu
,Tìm hiểu về Neo4J,,1,221,Hệ thống thông tin quản lý,Hệ thống thông tin quản lý,HUTECH,Hướng nghiên cứu
,Tìm hiểu về Query plans,,1,221,Hệ thống thông tin quản lý,Hệ thống thông tin quản lý,HUTECH,Hướng nghiên cứu
,Ứng dụng của machine learning trong gợi ý sản phẩm.,,1,221,Hệ thống thông tin quản lý,Hệ thống thông tin quản lý,HUTECH,"Gợi ý bán hàng, nhạc, phim"
,"Phân tích thị hiếu khách hàng (nhạc, tiểu thuyết)",,1,221,Hệ thống thông tin quản lý,Hệ thống thông tin quản lý,HUTECH,Bộ dữ liệu cho sẵn
,Tìm hiểu về quy trình xây dựng và tối ưu hóa website bán hàng thương mại điện tử,,1,221,Hệ thống thông tin quản lý,Hệ thống thông tin quản lý,HUTECH,Hướng nghiên cứu
,Phân tích yếu tố ảnh hưởng đến hành vi mua hàng/ sử dụng dịch vụ trong Thương mại điện tử.,,1,221,Hệ thống thông tin quản lý,Hệ thống thông tin quản lý,HUTECH,Hướng nghiên cứu
,Xây dựng công cụ phân tích dữ liệu digital marketing,,1,221,Hệ thống thông tin quản lý,Hệ thống thông tin quản lý,HUTECH,Hướng nghiên cứu
,Triển khai hệ thống thông tin,,1,202,Hệ thống thông tin quản lý,Hệ thống thông tin quản lý,HUTECH,Hướng nghiên cứu
,Quản trị dự án hệ thống thông tin,,1,202,Hệ thống thông tin quản lý,Hệ thống thông tin quản lý,HUTECH,Hướng nghiên cứu
,Nghiên cứu tình huống,,1,202,Hệ thống thông tin quản lý,Hệ thống thông tin quản lý,HUTECH,Hướng nghiên cứu
,Thiết kế cơ sở dữ liệu cho một trang thương mại điện tử,,1,202,Hệ thống thông tin quản lý,Hệ thống thông tin quản lý,HUTECH,Đáp ứng được một số yêu cầu
,Tìm hiểu về NoSQL Database,,1,202,Hệ thống thông tin quản lý,Hệ thống thông tin quản lý,HUTECH,
,Phân tích đặc điểm người dùng dựa trên dữ liệu thu thập được,,1,202,Hệ thống thông tin quản lý,Hệ thống thông tin quản lý,HUTECH,Bộ dữ liệu cho sẵn
,Phân tích 1 ứng dụng của machine learning trong gợi ý sản phẩm.,,1,202,Hệ thống thông tin quản lý,Hệ thống thông tin quản lý,HUTECH,"Gợi ý bán hàng, nhạc, phim"
,Phân tích 1 ứng dụng của machine learning trong mạng xã hội.,,1,202,Hệ thống thông tin quản lý,Hệ thống thông tin quản lý,HUTECH,"Gợi ý kết bạn, treo quảng cáo"
,"Phân tích dữ liệu digital marketing, xây dựng các mô hình dự báo về hành vi khách hàng",,1,202,Hệ thống thông tin quản lý,Hệ thống thông tin quản lý,HUTECH,Bộ dữ liệu cho sẵn
,Phân tích ảnh hưởng của quảng cáo trực tuyến đến hành vi khách hàng,,1,202,Hệ thống thông tin quản lý,Hệ thống thông tin quản lý,HUTECH,Bộ dữ liệu cho sẵn
,Phân tách nhóm khách hàng dựa trên tiêu chí,,1,202,Hệ thống thông tin quản lý,Hệ thống thông tin quản lý,HUTECH,Bộ dữ liệu cho sẵn
,Hệ Thống Thông Tin Quản Trị Nguồn Nhân Lực HRIS,,1,232,,,HUTECH,Hướng nghiên cứu
,Hệ Thống Thông Tin Quản Trị Tài Chính FMIS,,1,232,,,HUTECH,Hướng nghiên cứu
,Hệ Thống Thông Tin Quản Trị Chuỗi Cung Ứng SCIS,,1,232,,,HUTECH,Hướng nghiên cứu
,Hệ Thống Ngân Hàng Lõi Core Banking,,1,232,,,HUTECH,Hướng nghiên cứu
,Hệ Thống Thông Tin Chứng Khoán Đầu Tư SIS,,1,232,,,HUTECH,Hướng nghiên cứu
,E-Commerce,,1,232,,,HUTECH,Hướng nghiên cứu
,E-Business,,1,232,,,HUTECH,Hướng nghiên cứu
,Tìm hiểu về MongoDB,,1,232,,,HUTECH,Hướng nghiên cứu
,Tìm hiểu về Elasticsearch,,1,232,,,HUTECH,Hướng nghiên cứu
,Tìm hiểu về BigData,,1,232,,,HUTECH,Hướng nghiên cứu
,Tìm hiểu về Data Warehouse,,1,232,,,HUTECH,Hướng nghiên cứu
,Tìm hiểu phương pháp phân tích tương tác sản phẩm - người dùng,,1,232,,,HUTECH,Hướng nghiên cứu
,Tìm hiểu một số phương pháp phân tích dữ liệu bằng machine learning,,1,232,,,HUTECH,Hướng nghiên cứu
,Tìm hiểu về phân tích dữ liệu trong kinh doanh,,1,232,,,HUTECH,Hướng nghiên cứu
